sender,title,description,content
TeacherAlt,nullam varius nulla facilisi cras,,orci eget orci vehicula condimentum curabitur in libero ut massa volutpat convallis morbi odio odio elementum eu interdum eu tincidunt in leo maecenas
Principal,non velit nec,in imperdiet et commodo vulputate justo in blandit ultrices,pretium quis lectus suspendisse potenti in eleifend quam a odio in hac habitasse platea dictumst maecenas ut massa quis augue luctus tincidunt nulla mollis molestie lorem quisque ut erat
Admin,magna ac consequat metus sapien ut nunc,accumsan felis ut at dolor quis odio consequat,nec nisi volutpat eleifend donec ut dolor morbi vel lectus in quam fringilla rhoncus mauris enim leo rhoncus sed vestibulum sit amet cursus id turpis integer aliquet massa id lobortis convallis tortor risus dapibus augue vel accumsan tellus
VicePrincipal,mattis pulvinar,curae mauris viverra diam vitae quam,pellentesque viverra pede ac diam cras pellentesque volutpat dui maecenas tristique est et tempus semper est quam pharetra magna ac consequat metus sapien ut nunc vestibulum ante ipsum primis
TeacherAlt,nisi eu orci mauris lacinia,id turpis integer aliquet massa,penatibus et magnis dis parturient montes nascetur ridiculus mus vivamus vestibulum sagittis sapien cum sociis natoque penatibus et magnis dis parturient montes nascetur ridiculus mus etiam vel augue vestibulum rutrum rutrum
VicePrincipal,pellentesque quisque porta volutpat erat quisque erat eros,pede libero quis orci nullam molestie nibh in,cubilia curae donec pharetra magna vestibulum aliquet ultrices erat tortor sollicitudin mi sit amet lobortis sapien sapien non mi integer
Admin,convallis eget eleifend,pellentesque volutpat dui maecenas tristique est et tempus semper est,quis orci nullam molestie nibh in lectus pellentesque at nulla suspendisse potenti cras in purus eu magna vulputate luctus cum sociis natoque penatibus et
TeacherAlt,quisque porta volutpat erat quisque erat eros viverra,pede libero quis orci nullam molestie,lacus at velit vivamus vel nulla eget eros elementum pellentesque quisque porta volutpat erat quisque erat eros viverra eget congue eget semper rutrum nulla nunc purus phasellus in felis donec semper sapien a
Teacher,consectetuer adipiscing elit proin interdum mauris non ligula,pretium quis lectus suspendisse potenti in eleifend quam a odio,ultrices posuere cubilia curae duis faucibus accumsan odio curabitur convallis duis consequat dui nec nisi volutpat eleifend donec ut dolor morbi vel lectus in quam fringilla rhoncus mauris enim leo rhoncus
Teacher,ut volutpat sapien arcu,metus sapien ut nunc vestibulum ante ipsum,massa donec dapibus duis at velit eu est congue elementum in hac habitasse platea dictumst morbi vestibulum velit id pretium iaculis diam
Admin,quis turpis sed ante vivamus,,vestibulum ac est lacinia nisi venenatis tristique fusce congue diam id ornare imperdiet sapien urna pretium nisl ut volutpat sapien arcu sed augue aliquam erat volutpat in congue
Student,leo maecenas pulvinar lobortis est,fusce congue diam id ornare imperdiet sapien urna pretium nisl,diam id ornare imperdiet sapien urna pretium nisl ut volutpat sapien arcu sed augue aliquam erat volutpat in congue etiam justo etiam pretium iaculis
TeacherAlt,lorem id ligula suspendisse ornare consequat lectus in,fusce congue diam id ornare imperdiet sapien urna pretium,bibendum felis sed interdum venenatis turpis enim blandit mi in porttitor pede justo eu massa donec dapibus duis at velit eu
Admin,adipiscing elit proin risus,lobortis vel dapibus at diam nam,mauris laoreet ut rhoncus aliquet pulvinar sed nisl nunc rhoncus dui vel sem sed sagittis nam congue risus semper porta volutpat quam pede lobortis ligula sit amet eleifend pede libero quis orci nullam molestie nibh in lectus pellentesque at
TeacherAlt,viverra eget,in hac habitasse platea dictumst,nonummy integer non velit donec diam neque vestibulum eget vulputate ut ultrices vel augue vestibulum ante ipsum primis in faucibus orci luctus et
Admin,aliquam erat volutpat in congue etiam justo,et ultrices posuere cubilia curae duis,lobortis ligula sit amet eleifend pede libero quis orci nullam molestie nibh in lectus pellentesque at nulla suspendisse potenti cras in purus eu magna vulputate luctus cum sociis natoque penatibus et magnis dis parturient montes nascetur ridiculus mus
Admin,vel ipsum praesent blandit lacinia,vitae ipsum aliquam non mauris morbi,tincidunt nulla mollis molestie lorem quisque ut erat curabitur gravida nisi at nibh in hac habitasse platea dictumst aliquam augue quam sollicitudin vitae consectetuer eget
Admin,eget vulputate ut ultrices,amet diam in magna bibendum imperdiet nullam orci pede,sem duis aliquam convallis nunc proin at turpis a pede posuere nonummy integer non velit donec diam neque vestibulum eget vulputate ut ultrices vel augue vestibulum ante ipsum primis in faucibus
TeacherAlt,et magnis dis parturient montes nascetur ridiculus,cursus urna ut tellus nulla ut erat id mauris,at nunc commodo placerat praesent blandit nam nulla integer pede justo lacinia eget tincidunt eget tempus vel pede morbi porttitor lorem id ligula suspendisse ornare consequat lectus in est risus auctor sed
VicePrincipal,auctor sed tristique in tempus sit,elit proin risus praesent lectus,in faucibus orci luctus et ultrices posuere cubilia curae duis faucibus accumsan odio curabitur convallis duis consequat dui nec nisi volutpat eleifend donec ut dolor morbi vel lectus in quam fringilla rhoncus mauris
VicePrincipal,lectus suspendisse potenti in,accumsan odio curabitur convallis duis consequat dui nec,fermentum donec ut mauris eget massa tempor convallis nulla neque libero convallis eget eleifend luctus ultricies eu nibh quisque id justo sit amet sapien dignissim vestibulum vestibulum ante ipsum primis in
Teacher,non lectus aliquam sit,neque libero convallis eget eleifend luctus,odio odio elementum eu interdum eu tincidunt in leo maecenas pulvinar lobortis est phasellus sit amet erat nulla tempus vivamus in felis eu sapien cursus
Student,pede posuere,posuere cubilia curae duis faucibus accumsan,commodo placerat praesent blandit nam nulla integer pede justo lacinia eget tincidunt eget tempus vel pede morbi porttitor lorem id ligula suspendisse ornare
Principal,accumsan felis ut at dolor quis,ac est lacinia nisi venenatis tristique fusce congue diam,quisque ut erat curabitur gravida nisi at nibh in hac habitasse platea dictumst aliquam augue quam sollicitudin vitae consectetuer eget rutrum at lorem integer tincidunt ante vel ipsum praesent blandit lacinia erat vestibulum sed magna at
TeacherAlt,sit amet eleifend pede libero quis orci,augue aliquam erat volutpat in congue etiam justo etiam,blandit ultrices enim lorem ipsum dolor sit amet consectetuer adipiscing elit proin interdum mauris non ligula pellentesque ultrices phasellus id sapien in sapien iaculis congue vivamus metus arcu adipiscing molestie hendrerit at vulputate vitae nisl aenean lectus pellentesque eget nunc
Teacher,proin eu mi nulla ac enim,vel pede morbi porttitor lorem id,aenean sit amet justo morbi ut odio cras mi pede malesuada in imperdiet et commodo vulputate justo in blandit ultrices enim lorem ipsum dolor sit amet consectetuer adipiscing elit proin interdum mauris non ligula pellentesque ultrices phasellus id sapien
Student,diam vitae quam suspendisse potenti nullam,elit ac nulla sed vel,maecenas pulvinar lobortis est phasellus sit amet erat nulla tempus vivamus in felis eu sapien cursus vestibulum proin eu mi nulla ac enim in tempor turpis nec euismod scelerisque quam turpis adipiscing lorem
Student,mauris sit amet eros suspendisse accumsan tortor,,aliquet massa id lobortis convallis tortor risus dapibus augue vel accumsan tellus nisi eu orci mauris lacinia sapien quis libero nullam sit amet
Admin,massa id lobortis convallis tortor,pellentesque ultrices phasellus id sapien in sapien iaculis congue,at turpis donec posuere metus vitae ipsum aliquam non mauris morbi non lectus aliquam sit amet diam in magna bibendum imperdiet nullam orci pede venenatis non sodales sed tincidunt eu felis fusce posuere felis sed lacus morbi sem
Student,morbi odio,nisl nunc nisl duis bibendum felis sed interdum venenatis turpis,justo sollicitudin ut suscipit a feugiat et eros vestibulum ac est lacinia nisi venenatis tristique fusce congue diam id ornare imperdiet sapien urna pretium nisl ut volutpat sapien arcu sed augue aliquam erat volutpat in congue